{
  "schemaVersion": 1,
  "id": "octubre-2026",
  "name": "Programa octubre",
  "description": "Fuerza, acondicionamiento y constancia. Un entrenamiento a la vez.",
  "days": [
    {
      "id": "lunes",
      "label": "Lunes",
      "weekday": 1,
      "focus": "Pecho & hombros",
      "blocks": [
        {
          "id": "lunes-b1",
          "name": "Activación",
          "notes": "",
          "timerSeconds": 0,
          "exercises": [
            {
              "id": "lunes-b1-e1",
              "name": "Bike",
              "target": "10 min",
              "sets": 1,
              "tracking": "cardio",
              "metric": "time"
            },
            {
              "id": "lunes-b1-e2",
              "name": "Saltos de cuerda",
              "target": "150 saltos",
              "sets": 1,
              "tracking": "bodyweight",
              "metric": "reps"
            },
            {
              "id": "lunes-b1-e3",
              "name": "Shoulder taps",
              "target": "20 reps",
              "sets": 1,
              "tracking": "mobility",
              "metric": "reps"
            },
            {
              "id": "lunes-b1-e4",
              "name": "Down up",
              "target": "10 reps",
              "sets": 1,
              "tracking": "bodyweight",
              "metric": "reps"
            },
            {
              "id": "lunes-b1-e5",
              "name": "Push ups",
              "target": "30 reps",
              "sets": 1,
              "catalogId": "Pushups",
              "tracking": "bodyweight",
              "metric": "reps"
            }
          ]
        },
        {
          "id": "lunes-b2",
          "name": "Fuerza",
          "notes": "",
          "timerSeconds": 0,
          "exercises": [
            {
              "id": "lunes-b2-e1",
              "name": "Bench press · banco plano",
              "target": "8 reps",
              "sets": 4,
              "catalogId": "Barbell_Bench_Press_-_Medium_Grip",
              "tracking": "weighted",
              "metric": "reps"
            },
            {
              "id": "lunes-b2-e2",
              "name": "Peck deck",
              "target": "12 reps",
              "sets": 4,
              "tracking": "weighted",
              "metric": "reps"
            },
            {
              "id": "lunes-b2-e3",
              "name": "Bench press inclinado · máquina",
              "target": "6 reps",
              "sets": 3,
              "tracking": "weighted",
              "metric": "reps"
            },
            {
              "id": "lunes-b2-e4",
              "name": "Press Z · dual KB",
              "target": "10 reps",
              "sets": 4,
              "tracking": "weighted",
              "metric": "reps"
            },
            {
              "id": "lunes-b2-e5",
              "name": "Lateral raises",
              "target": "12 reps",
              "sets": 3,
              "catalogId": "Side_Lateral_Raise",
              "tracking": "weighted",
              "metric": "reps"
            },
            {
              "id": "lunes-b2-e6",
              "name": "Soga extension",
              "target": "15 reps",
              "sets": 4,
              "catalogId": "Triceps_Pushdown_-_Rope_Attachment",
              "tracking": "weighted",
              "metric": "reps"
            }
          ]
        },
        {
          "id": "lunes-b3",
          "name": "Workout",
          "notes": "5 rondas. Marca cada movimiento al terminar las cinco rondas.",
          "timerSeconds": 0,
          "exercises": [
            {
              "id": "lunes-b3-e1",
              "name": "Run",
              "target": "200 m",
              "sets": 1,
              "tracking": "cardio",
              "metric": "distance"
            },
            {
              "id": "lunes-b3-e2",
              "name": "Dual DB hang clean and press",
              "target": "10 reps",
              "sets": 1,
              "tracking": "weighted",
              "metric": "reps"
            },
            {
              "id": "lunes-b3-e3",
              "name": "MB slam",
              "target": "10 reps",
              "sets": 1,
              "tracking": "weighted",
              "metric": "reps"
            },
            {
              "id": "lunes-b3-e4",
              "name": "Burpees",
              "target": "10 reps",
              "sets": 1,
              "tracking": "bodyweight",
              "metric": "reps"
            },
            {
              "id": "lunes-b3-e5",
              "name": "Sit ups",
              "target": "10 reps",
              "sets": 1,
              "tracking": "bodyweight",
              "metric": "reps"
            }
          ]
        }
      ]
    },
    {
      "id": "martes",
      "label": "Martes",
      "weekday": 2,
      "focus": "Pierna & core",
      "blocks": [
        {
          "id": "martes-b1",
          "name": "Activación",
          "notes": "",
          "timerSeconds": 0,
          "exercises": [
            {
              "id": "martes-b1-e1",
              "name": "Rotaciones 90/90",
              "target": "20 reps",
              "sets": 1,
              "tracking": "mobility",
              "metric": "reps"
            },
            {
              "id": "martes-b1-e2",
              "name": "Bootraper squats",
              "target": "15 reps",
              "sets": 1,
              "tracking": "mobility",
              "metric": "reps"
            },
            {
              "id": "martes-b1-e3",
              "name": "Lunges estáticos alternados",
              "target": "12 reps",
              "sets": 1,
              "tracking": "mobility",
              "metric": "reps"
            },
            {
              "id": "martes-b1-e4",
              "name": "Rings Cossack squats",
              "target": "10 reps",
              "sets": 1,
              "tracking": "mobility",
              "metric": "reps"
            }
          ]
        },
        {
          "id": "martes-b2",
          "name": "Fuerza",
          "notes": "",
          "timerSeconds": 0,
          "exercises": [
            {
              "id": "martes-b2-e1",
              "name": "Back squat",
              "target": "12 reps",
              "sets": 5,
              "catalogId": "Barbell_Full_Squat",
              "notes": "Carga del programa: #115. Unidad pendiente de confirmar.",
              "tracking": "weighted",
              "metric": "reps"
            },
            {
              "id": "martes-b2-e2",
              "name": "Leg extension",
              "target": "15 reps",
              "sets": 4,
              "catalogId": "Leg_Extensions",
              "tracking": "weighted",
              "metric": "reps"
            },
            {
              "id": "martes-b2-e3",
              "name": "Walking lunge + box jump",
              "target": "20 m + 10 BJ",
              "sets": 4,
              "tracking": "weighted",
              "metric": "mixed"
            },
            {
              "id": "martes-b2-e4",
              "name": "Lateral walk",
              "target": "12 m",
              "sets": 3,
              "notes": "Plate + band",
              "tracking": "weighted",
              "metric": "distance"
            }
          ]
        },
        {
          "id": "martes-b3",
          "name": "Workout",
          "notes": "AMRAP 12 min. Registra las rondas en el resultado del bloque.",
          "timerSeconds": 720,
          "exercises": [
            {
              "id": "martes-b3-e1",
              "name": "Row",
              "target": "150 m",
              "sets": 1,
              "tracking": "cardio",
              "metric": "distance"
            },
            {
              "id": "martes-b3-e2",
              "name": "MB thrusters",
              "target": "15 reps",
              "sets": 1,
              "tracking": "weighted",
              "metric": "reps"
            },
            {
              "id": "martes-b3-e3",
              "name": "Half burpee to plate",
              "target": "10 reps",
              "sets": 1,
              "tracking": "bodyweight",
              "metric": "reps"
            }
          ]
        },
        {
          "id": "martes-b4",
          "name": "Core",
          "notes": "3 rondas.",
          "timerSeconds": 0,
          "exercises": [
            {
              "id": "martes-b4-e1",
              "name": "Knee to chest",
              "target": "20 reps",
              "sets": 1,
              "tracking": "bodyweight",
              "metric": "reps"
            },
            {
              "id": "martes-b4-e2",
              "name": "Roll out",
              "target": "20 reps",
              "sets": 1,
              "catalogId": "Ab_Roller",
              "tracking": "bodyweight",
              "metric": "reps"
            },
            {
              "id": "martes-b4-e3",
              "name": "Plank",
              "target": "30 s",
              "sets": 1,
              "catalogId": "Plank",
              "tracking": "bodyweight",
              "metric": "time"
            }
          ]
        }
      ]
    },
    {
      "id": "miercoles",
      "label": "Miércoles",
      "weekday": 3,
      "focus": "Espalda & bíceps",
      "blocks": [
        {
          "id": "miercoles-b1",
          "name": "Activación",
          "notes": "",
          "timerSeconds": 0,
          "exercises": [
            {
              "id": "miercoles-b1-e1",
              "name": "Dead hang",
              "target": "20 s",
              "sets": 1,
              "tracking": "bodyweight",
              "metric": "time"
            },
            {
              "id": "miercoles-b1-e2",
              "name": "Swimmers",
              "target": "10 reps",
              "sets": 1,
              "tracking": "mobility",